[
  {
    "name": "African Folktales with Miss Jo Jo",
    "category": "histoire",
    "rssUrl": "https://feeds.megaphone.fm/ABFC5921681986",
    "description": "Diverse short stories originating in Africa, originally passed down through generations by word of mouth. These traditional tales told with a new twist, are not only entertaining but serve to teach a lesson as well. Sometimes of a moral value and other times of survival.",
    "tags": [
      "contes-classiques"
    ]
  },
  {
    "name": "Big Life Kids Podcast",
    "publisher": "Biglifejournal",
    "category": "education",
    "rssUrl": "https://feeds.acast.com/public/shows/5cb71b81fe324a2e6bebb634",
    "description": "The *Big Life Kids podcas*t teaches children to stay resilient, believe in themselves, and face life's challenges with confidence! In each episode, Zara and Leo travel the world to discover the living heroes that are making a difference in the world today.",
    "websiteUrl": "https://biglifejournal.com/podcast",
    "tags": [
      "emotions-bienetre",
      "geographie-voyages",
      "heros-filles"
    ]
  },
  {
    "name": "Keyshawn Solves It",
    "publisher": "Play",
    "category": "histoire",
    "rssUrl": "https://feeds.wgbh.org/3822/feed-rss.xml",
    "description": "8-episode serialized mystery about a 10-year-old African-American boy who inherits a set of keys that can unlock almost any door. With help from his friend Kiki, Keyshawn uses these keys to help solve a mystery.",
    "websiteUrl": "https://play.prx.org/listen?uf=https%3A%2F%2Ffeeds.wgbh.org%2F3822%2Ffeed-rss.xml",
    "tags": [
      "animaux",
      "technologie"
    ]
  },
  {
    "name": "The holidays",
    "publisher": "Spreaker",
    "category": "histoire",
    "rssUrl": "https://feeds.megaphone.fm/SBP4218457195",
    "websiteUrl": "https://www.spreaker.com/show/the-holidays",
    "tags": [
      "humour",
      "geographie-voyages",
      "arts-culture"
    ]
  },
  {
    "name": "The Plate Show",
    "publisher": "Pbslearningmedia",
    "category": "education",
    "rssUrl": "https://publicfeeds.net/f/4977/feed-rss.xml",
    "description": "Comedy podcast about cultures around the world and the foods that are important to them. Join Spoonie, everyone’s favorite talking spoon, and her BFF sidekick Tongs, as they put on a show from their very own kitchen to learn about – and taste – amazing food from around the world!",
    "websiteUrl": "https://www.pbslearningmedia.org/collection/theplateshowpodcast/",
    "tags": [
      "arts-culture"
    ]
  }
]
