[
  {
    "name": "Circle Round",
    "publisher": "Wbur",
    "category": "histoire",
    "rssUrl": "https://rss.wbur.org/circleround/podcast",
    "description": "WBUR's Circle Round adapts carefully-selected folktales from around the world into sound- and music-rich radio plays for kids ages 3-103. Each 15 to 25-minute episode explores important issues like kindness, persistence and generosity.",
    "websiteUrl": "https://www.wbur.org/podcasts/circleround",
    "tags": [
      "contes-classiques"
    ],
    "imageUrl": "https://media.wbur.org/wp/2017/06/Circle-Round_3000x3000_Summer.jpg"
  },
  {
    "name": "Draw Along Stories",
    "category": "education",
    "rssUrl": "https://anchor.fm/s/25ebb444/podcast/rss",
    "description": "\"Draw Along Stories\" encourages the inner artist in all young ones! In each episode La La shares an original story or poem and invites kiddos to draw the images they see in their imagination while listening in.",
    "publisher": "La La Lindsey",
    "imageUrl": "https://d3t3ozftmdmh3i.cloudfront.net/production/podcast_uploaded/6262041/6262041-1591912612008-f5e7336d6d645.jpg",
    "websiteUrl": "https://www.lalalindsey.com"
  },
  {
    "name": "Story Train: Magical Bedtime Stories for Kids",
    "publisher": "Gokidgo",
    "category": "histoire",
    "rssUrl": "https://www.spreaker.com/show/5196976/episodes/feed",
    "description": "Storytelling escapades designed specifically for children aged four and up! Dive into fantastic, G-rated tales that transport young listeners on magical journeys to far-off places across the globe.",
    "websiteUrl": "https://www.gokidgo.com/storytrain",
    "tags": [
      "sante-corps"
    ],
    "imageUrl": "https://megaphone.imgix.net/podcasts/bf66c91e-4cd8-11ee-a661-a3d6991628c1/image/5515221af1297ab79740ac4e4351c3cb.png?ixlib=rails-4.3.1&max-w=3000&max-h=3000&fit=crop&auto=format,compress"
  }
]
